{
  "lead_id": "lead-135b2ad48044aecc74d0",
  "name": "Disabled American Veterans - London KY",
  "status": "queued",
  "category": "veterans",
  "county": "Laurel",
  "state": "KY",
  "zip": "40744",
  "first_seen": "2026-09-28T04:40:30Z",
  "candidate_id": null,
  "resource_id": null,
  "history_paths": [],
  "observations": {
    "name": "Disabled American Veterans - London KY",
    "normalized_names": [
      "disabled american veterans london ky"
    ],
    "phones": [],
    "domains": [],
    "urls": [],
    "addresses": [
      "300 dav ln"
    ],
    "zip": "40744",
    "located_zip": "40741",
    "county": "Laurel",
    "state": "KY",
    "first_seen": "2026-09-28T04:40:30Z",
    "last_seen": "2026-09-28T04:40:30Z",
    "times_seen": 1,
    "source_run_ids": [
      "leadgen-40744-20260928T044030Z"
    ],
    "source_url": "https://warriorsfund.org/city/ky/london",
    "category": "veterans",
    "description": null,
    "url": null,
    "address": "300 DAV LN",
    "city": "London",
    "hours": null,
    "eligibility": null,
    "cost": "unknown",
    "populations": [],
    "service_types": [],
    "source_urls": [
      "https://warriorsfund.org/city/ky/london"
    ],
    "notes": null,
    "verification_status": "unverified",
    "confidence": "medium",
    "found_in_zip": "40744",
    "session_run_id": "leadgen-40744-20260928T042829Z",
    "found_at": "2026-09-28T04:39:02Z",
    "source_run_id": "leadgen-40744-20260928T044030Z",
    "classification": "new",
    "matched": null
  },
  "claim": null,
  "audit": [
    {
      "event": "imported",
      "at": "2026-09-30",
      "note": "Imported discovery observations; history links are name matches requiring intake confirmation."
    }
  ]
}
