{
  "lead_id": "lead-b75225ba299acf0b22db",
  "name": "Fed By Grace Food Pantry (Grace Fellowship)",
  "status": "queued",
  "category": "food",
  "county": "Laurel",
  "state": "KY",
  "zip": "40744",
  "first_seen": "2026-09-28T04:19:14Z",
  "candidate_id": null,
  "resource_id": null,
  "history_paths": [],
  "observations": {
    "name": "Fed By Grace Food Pantry (Grace Fellowship)",
    "normalized_names": [
      "fed by grace food pantry grace fellowship"
    ],
    "phones": [
      "6068644635"
    ],
    "domains": [],
    "urls": [],
    "addresses": [
      "911 tlc lane"
    ],
    "zip": "40744",
    "located_zip": "40744",
    "county": "Laurel",
    "state": "KY",
    "first_seen": "2026-09-28T04:19:14Z",
    "last_seen": "2026-09-28T04:19:14Z",
    "times_seen": 1,
    "source_run_ids": [
      "leadgen-40744-20260928T041914Z"
    ],
    "source_url": "https://www.laurelcohealthdept.org/resources-food",
    "category": "food",
    "description": "Church-based food pantry in London (ZIP 40744).",
    "url": null,
    "address": "911 TLC Lane",
    "city": "London",
    "hours": "Tuesday 11:00 AM \u2013 1:00 PM",
    "eligibility": null,
    "cost": "unknown",
    "populations": [],
    "service_types": [],
    "source_urls": [
      "https://www.laurelcohealthdept.org/resources-food"
    ],
    "notes": null,
    "verification_status": "unverified",
    "confidence": "medium",
    "found_in_zip": "40744",
    "session_run_id": "leadgen-40744-20260928T015514Z",
    "found_at": "2026-09-28T01:57:04Z",
    "source_run_id": "leadgen-40744-20260928T041914Z",
    "classification": "new",
    "matched": null
  },
  "claim": null,
  "audit": [
    {
      "event": "imported",
      "at": "2026-09-30",
      "note": "Imported discovery observations; history links are name matches requiring intake confirmation."
    }
  ]
}
