{
  "lead_id": "lead-d331a392ceeae6e31f93",
  "name": "Grace Health - Cumberland Falls Highway Clinic",
  "status": "queued",
  "category": "health",
  "county": "Laurel",
  "state": "KY",
  "zip": "40744",
  "first_seen": "2026-09-28T04:19:14Z",
  "candidate_id": null,
  "resource_id": null,
  "history_paths": [],
  "observations": {
    "name": "Grace Health - Cumberland Falls Highway Clinic",
    "normalized_names": [
      "grace health cumberland falls highway clinic"
    ],
    "phones": [
      "6065284481"
    ],
    "domains": [],
    "urls": [],
    "addresses": [
      "1419 cumberland falls hwy"
    ],
    "zip": "40744",
    "located_zip": "40701",
    "county": "Laurel",
    "state": "KY",
    "first_seen": "2026-09-28T04:19:14Z",
    "last_seen": "2026-09-28T04:19:14Z",
    "times_seen": 1,
    "source_run_ids": [
      "leadgen-40744-20260928T041914Z"
    ],
    "source_url": "https://www.freeclinics.com/cit/ky-london",
    "category": "health",
    "description": "Grace Health community health clinic near London (14 miles) offering sliding-scale primary care.",
    "url": null,
    "address": "1419 Cumberland Falls Highway",
    "city": "Corbin",
    "hours": "Monday 8:00 AM - 6:00 PM",
    "eligibility": "Low-income and uninsured; sliding scale",
    "cost": "sliding-scale",
    "populations": [],
    "service_types": [],
    "source_urls": [
      "https://www.freeclinics.com/cit/ky-london"
    ],
    "notes": null,
    "verification_status": "unverified",
    "confidence": "medium",
    "found_in_zip": "40744",
    "session_run_id": "leadgen-40744-20260928T015514Z",
    "found_at": "2026-09-28T02:03:11Z",
    "source_run_id": "leadgen-40744-20260928T041914Z",
    "classification": "new",
    "matched": null
  },
  "claim": null,
  "audit": [
    {
      "event": "imported",
      "at": "2026-09-30",
      "note": "Imported discovery observations; history links are name matches requiring intake confirmation."
    }
  ]
}
