{
  "lead_id": "lead-b4ab1c9a9adf6ea6ab16",
  "name": "Disabled American Veterans (DAV) Chapter 66",
  "status": "queued",
  "category": "veterans",
  "county": "Laurel",
  "state": "KY",
  "zip": "40744",
  "first_seen": "2026-09-28T04:19:14Z",
  "candidate_id": null,
  "resource_id": null,
  "history_paths": [],
  "observations": {
    "name": "Disabled American Veterans (DAV) Chapter 66",
    "normalized_names": [
      "disabled american veterans dav chapter 66"
    ],
    "phones": [
      "6068771308"
    ],
    "domains": [
      "davwebsites.dav.org"
    ],
    "urls": [
      "davwebsites.dav.org/ky/66/SystemPages/Home.aspx"
    ],
    "addresses": [
      "300 dav lane"
    ],
    "zip": "40744",
    "located_zip": "40741",
    "county": "Laurel",
    "state": "KY",
    "first_seen": "2026-09-28T04:19:14Z",
    "last_seen": "2026-09-28T04:19:14Z",
    "times_seen": 1,
    "source_run_ids": [
      "leadgen-40744-20260928T041914Z"
    ],
    "source_url": "https://www.laurelcohealthdept.org/resources-transportation-1",
    "category": "veterans",
    "description": "Disabled American Veterans Chapter 66 - meetings 3rd Thursday of the month at 6pm. Assistance for disabled veterans.",
    "url": "https://davwebsites.dav.org/ky/66/SystemPages/Home.aspx",
    "address": "300 Dav Lane",
    "city": "London",
    "hours": null,
    "eligibility": null,
    "cost": "unknown",
    "populations": [
      "veterans",
      "disability"
    ],
    "service_types": [
      "peer-led"
    ],
    "source_urls": [
      "https://www.laurelcohealthdept.org/resources-transportation-1",
      "https://davwebsites.dav.org/ky/66/SystemPages/Home.aspx"
    ],
    "notes": null,
    "verification_status": "unverified",
    "confidence": "medium",
    "found_in_zip": "40744",
    "session_run_id": "leadgen-40744-20260928T015514Z",
    "found_at": "2026-09-28T02:09:26Z",
    "source_run_id": "leadgen-40744-20260928T041914Z",
    "classification": "new",
    "matched": null
  },
  "claim": null,
  "audit": [
    {
      "event": "imported",
      "at": "2026-09-30",
      "note": "Imported discovery observations; history links are name matches requiring intake confirmation."
    }
  ]
}
