{
  "lead_id": "lead-c341846fe0629f12b792",
  "name": "Laurel County Crime Victims Assistance",
  "status": "queued",
  "category": "legal",
  "county": "Laurel",
  "state": "KY",
  "zip": "40744",
  "first_seen": "2026-09-28T04:19:14Z",
  "candidate_id": null,
  "resource_id": null,
  "history_paths": [],
  "observations": {
    "name": "Laurel County Crime Victims Assistance",
    "normalized_names": [
      "laurel county crime victims assistance"
    ],
    "phones": [],
    "domains": [
      "localoffices.org"
    ],
    "urls": [
      "localoffices.org/victim-assistance/kentucky/laurel-county"
    ],
    "addresses": [],
    "zip": "40744",
    "located_zip": "40744",
    "county": "Laurel",
    "state": "KY",
    "first_seen": "2026-09-28T04:19:14Z",
    "last_seen": "2026-09-28T04:19:14Z",
    "times_seen": 1,
    "source_run_ids": [
      "leadgen-40744-20260928T041914Z"
    ],
    "source_url": "https://www.localoffices.org/victim-assistance/kentucky/laurel-county",
    "category": "legal",
    "description": "Laurel County Crime Victims Assistance - provides educational programs, compassionate support, in-person counseling, support groups, and emergency assistance to crime victims in Laurel County.",
    "url": "https://www.localoffices.org/victim-assistance/kentucky/laurel-county",
    "address": null,
    "city": "London",
    "hours": null,
    "eligibility": "Victims of crime in Laurel County",
    "cost": "free",
    "populations": [
      "anyone"
    ],
    "service_types": [
      "walk-in",
      "appointment"
    ],
    "source_urls": [
      "https://www.localoffices.org/victim-assistance/kentucky/laurel-county",
      "https://legalaid.thecountyoffice.com/community-resource-center/laurel-county-crime-victims-assistance-216723/"
    ],
    "notes": null,
    "verification_status": "unverified",
    "confidence": "medium",
    "found_in_zip": "40744",
    "session_run_id": "leadgen-40744-20260928T015514Z",
    "found_at": "2026-09-28T02:14:28Z",
    "source_run_id": "leadgen-40744-20260928T041914Z",
    "classification": "new",
    "matched": null
  },
  "claim": null,
  "audit": [
    {
      "event": "imported",
      "at": "2026-09-30",
      "note": "Imported discovery observations; history links are name matches requiring intake confirmation."
    }
  ]
}
