{
  "lead_id": "lead-bc0bf884600646dece68",
  "name": "Cumberland River Behavioral Health - London Office",
  "status": "queued",
  "category": "mental-health",
  "county": "Laurel",
  "state": "KY",
  "zip": "40744",
  "first_seen": "2026-09-28T04:40:30Z",
  "candidate_id": null,
  "resource_id": null,
  "history_paths": [],
  "observations": {
    "name": "Cumberland River Behavioral Health - London Office",
    "normalized_names": [
      "cumberland river behavioral health london office"
    ],
    "phones": [
      "6064046515"
    ],
    "domains": [],
    "urls": [],
    "addresses": [
      "225 north laurel rd"
    ],
    "zip": "40744",
    "located_zip": "40741",
    "county": "Laurel",
    "state": "KY",
    "first_seen": "2026-09-28T04:40:30Z",
    "last_seen": "2026-09-28T04:40:30Z",
    "times_seen": 1,
    "source_run_ids": [
      "leadgen-40744-20260928T044030Z"
    ],
    "source_url": "https://rehabs.com/listings/cumberland-river-behavioral-health-546933609/",
    "category": "mental-health",
    "description": null,
    "url": null,
    "address": "225 North Laurel Road",
    "city": "London",
    "hours": null,
    "eligibility": null,
    "cost": "unknown",
    "populations": [],
    "service_types": [],
    "source_urls": [
      "https://rehabs.com/listings/cumberland-river-behavioral-health-546933609/",
      "https://www.mapquest.com/us/kentucky/cumberland-river-behavioral-health-379822852"
    ],
    "notes": null,
    "verification_status": "unverified",
    "confidence": "medium",
    "found_in_zip": "40744",
    "session_run_id": "leadgen-40744-20260928T042829Z",
    "found_at": "2026-09-28T04:36:11Z",
    "source_run_id": "leadgen-40744-20260928T044030Z",
    "classification": "new",
    "matched": null
  },
  "claim": null,
  "audit": [
    {
      "event": "imported",
      "at": "2026-09-30",
      "note": "Imported discovery observations; history links are name matches requiring intake confirmation."
    }
  ]
}
