{
  "lead_id": "lead-0d10a292b35df049d18f",
  "name": "Christian Homeless Shelter (London KY)",
  "status": "published",
  "category": "shelter",
  "county": "Laurel",
  "state": "KY",
  "zip": "40744",
  "first_seen": "2026-09-28T04:40:30Z",
  "candidate_id": null,
  "resource_id": "laurel-christian-homeless-shelter-london-ky-889383",
  "history_paths": [
    "source/approved/laurel/laurel-christian-homeless-shelter-london-ky-889383.yaml"
  ],
  "observations": {
    "name": "Christian Homeless Shelter (London KY)",
    "normalized_names": [
      "christian homeless shelter london ky"
    ],
    "phones": [
      "6063300785"
    ],
    "domains": [],
    "urls": [],
    "addresses": [
      "p o box 1465"
    ],
    "zip": "40744",
    "located_zip": "40743",
    "county": "Laurel",
    "state": "KY",
    "first_seen": "2026-09-28T04:40:30Z",
    "last_seen": "2026-09-28T04:40:30Z",
    "times_seen": 1,
    "source_run_ids": [
      "leadgen-40744-20260928T044030Z"
    ],
    "source_url": "https://www.thehelplist.com/co/ky-laurel",
    "category": "shelter",
    "description": null,
    "url": null,
    "address": "P.O. Box 1465",
    "city": "London",
    "hours": null,
    "eligibility": "Families and singles; seven one-bedroom family units, 25-bed men's dorm, 7-bed women's dorm",
    "cost": "free",
    "populations": [],
    "service_types": [
      "residential"
    ],
    "source_urls": [
      "https://www.thehelplist.com/co/ky-laurel"
    ],
    "notes": null,
    "verification_status": "unverified",
    "confidence": "medium",
    "found_in_zip": "40744",
    "session_run_id": "leadgen-40744-20260928T042829Z",
    "found_at": "2026-09-28T04:39:57Z",
    "source_run_id": "leadgen-40744-20260928T044030Z",
    "classification": "new",
    "matched": null
  },
  "claim": null,
  "audit": [
    {
      "event": "imported",
      "at": "2026-09-30",
      "note": "Imported discovery observations; history links are name matches requiring intake confirmation."
    }
  ]
}
