{
  "lead_id": "lead-9201017d2c9a7c717e3a",
  "name": "Daniel Boone Community Action Agency",
  "status": "queued",
  "category": "utility-assistance",
  "county": "Laurel",
  "state": "KY",
  "zip": "40744",
  "first_seen": "2026-09-28T04:19:14Z",
  "candidate_id": null,
  "resource_id": null,
  "history_paths": [],
  "observations": {
    "name": "Daniel Boone Community Action Agency",
    "normalized_names": [
      "daniel boone community action agency"
    ],
    "phones": [
      "6063667433"
    ],
    "domains": [
      "danielboonecaa.org"
    ],
    "urls": [
      "danielboonecaa.org"
    ],
    "addresses": [
      "188 dog patch trading center"
    ],
    "zip": "40744",
    "located_zip": "40741",
    "county": "Laurel",
    "state": "KY",
    "first_seen": "2026-09-28T04:19:14Z",
    "last_seen": "2026-09-28T04:19:14Z",
    "times_seen": 1,
    "source_run_ids": [
      "leadgen-40744-20260928T041914Z"
    ],
    "source_url": "https://www.laurelcohealthdept.org/resources-housing",
    "category": "utility-assistance",
    "description": "Daniel Boone Community Action Agency offers LIHEAP energy assistance, Tenant Based Rental Assistance (TBRA) for rent/security/utility deposits, weatherization, and homeownership services for low-income families in Clay, Jackson, Laurel and Rockcastle counties.",
    "url": "https://danielboonecaa.org/",
    "address": "188 Dog Patch Trading Center",
    "city": "London",
    "hours": "Mon-Fri 8:00am-4:30pm",
    "eligibility": "Low-income families meeting federal income guidelines",
    "cost": "unknown",
    "populations": [],
    "service_types": [
      "walk-in",
      "appointment"
    ],
    "source_urls": [
      "https://www.laurelcohealthdept.org/resources-housing",
      "https://danielboonecaa.org/programs/housing"
    ],
    "notes": null,
    "verification_status": "unverified",
    "confidence": "medium",
    "found_in_zip": "40744",
    "session_run_id": "leadgen-40744-20260928T015514Z",
    "found_at": "2026-09-28T02:08:17Z",
    "source_run_id": "leadgen-40744-20260928T041914Z",
    "classification": "new",
    "matched": null
  },
  "claim": null,
  "audit": [
    {
      "event": "imported",
      "at": "2026-09-30",
      "note": "Imported discovery observations; history links are name matches requiring intake confirmation."
    }
  ]
}
