{
  "lead_id": "lead-b4a758a1ee7888c5fa47",
  "name": "Laurel County Public Library",
  "status": "queued",
  "category": "community",
  "county": "Laurel",
  "state": "KY",
  "zip": "40744",
  "first_seen": "2026-09-28T04:19:14Z",
  "candidate_id": null,
  "resource_id": null,
  "history_paths": [],
  "observations": {
    "name": "Laurel County Public Library",
    "normalized_names": [
      "laurel county public library"
    ],
    "phones": [],
    "domains": [
      "laurellibrary.org"
    ],
    "urls": [
      "laurellibrary.org"
    ],
    "addresses": [],
    "zip": "40744",
    "located_zip": "40744",
    "county": "Laurel",
    "state": "KY",
    "first_seen": "2026-09-28T04:19:14Z",
    "last_seen": "2026-09-28T04:19:14Z",
    "times_seen": 1,
    "source_run_ids": [
      "leadgen-40744-20260928T041914Z"
    ],
    "source_url": "https://www.laurellibrary.org/",
    "category": "community",
    "description": "Laurel County Public Library - free Wi-Fi, books, audiobooks, movies, digital resources, and community programs in London, KY.",
    "url": "https://www.laurellibrary.org/",
    "address": null,
    "city": "London",
    "hours": null,
    "eligibility": null,
    "cost": "free",
    "populations": [
      "anyone",
      "families",
      "youth"
    ],
    "service_types": [
      "walk-in"
    ],
    "source_urls": [
      "https://www.laurellibrary.org/",
      "https://www.laurelcohealthdept.org/resources-libraries"
    ],
    "notes": null,
    "verification_status": "unverified",
    "confidence": "medium",
    "found_in_zip": "40744",
    "session_run_id": "leadgen-40744-20260928T015514Z",
    "found_at": "2026-09-28T02:14:38Z",
    "source_run_id": "leadgen-40744-20260928T041914Z",
    "classification": "new",
    "matched": null
  },
  "claim": null,
  "audit": [
    {
      "event": "imported",
      "at": "2026-09-30",
      "note": "Imported discovery observations; history links are name matches requiring intake confirmation."
    }
  ]
}
