{
  "lead_id": "lead-7d051acc9c69867ba8f1",
  "name": "Calvary Baptist Church Food Pantry",
  "status": "published",
  "category": "food",
  "county": "Laurel",
  "state": "KY",
  "zip": "40744",
  "first_seen": "2026-09-28T04:19:14Z",
  "candidate_id": null,
  "resource_id": "laurel-calvary-baptist-church-food-pantry-0cb551",
  "history_paths": [
    "source/approved/laurel/laurel-calvary-baptist-church-food-pantry-0cb551.yaml"
  ],
  "observations": {
    "name": "Calvary Baptist Church Food Pantry",
    "normalized_names": [
      "calvary baptist church food pantry"
    ],
    "phones": [
      "6066820621"
    ],
    "domains": [],
    "urls": [],
    "addresses": [
      "111 n mcwhorter st"
    ],
    "zip": "40744",
    "located_zip": "40741",
    "county": "Laurel",
    "state": "KY",
    "first_seen": "2026-09-28T04:19:14Z",
    "last_seen": "2026-09-28T04:19:14Z",
    "times_seen": 1,
    "source_run_ids": [
      "leadgen-40744-20260928T041914Z"
    ],
    "source_url": "https://feedam.org/food-pantry/ky/london",
    "category": "food",
    "description": "Calvary Baptist Church food pantry - free food pantry in London KY.",
    "url": null,
    "address": "111 N. McWhorter St.",
    "city": "London",
    "hours": null,
    "eligibility": null,
    "cost": "unknown",
    "populations": [],
    "service_types": [],
    "source_urls": [
      "https://feedam.org/food-pantry/ky/london",
      "https://www.laurelcohealthdept.org/resources-food"
    ],
    "notes": null,
    "verification_status": "unverified",
    "confidence": "medium",
    "found_in_zip": "40744",
    "session_run_id": "leadgen-40744-20260928T015514Z",
    "found_at": "2026-09-28T02:14:16Z",
    "source_run_id": "leadgen-40744-20260928T041914Z",
    "classification": "new",
    "matched": null
  },
  "claim": null,
  "audit": [
    {
      "event": "imported",
      "at": "2026-09-30",
      "note": "Imported discovery observations; history links are name matches requiring intake confirmation."
    }
  ]
}
