{
  "lead_id": "lead-e883ce46938344626554",
  "name": "AppalReD Legal Aid",
  "status": "queued",
  "category": "legal",
  "county": "Laurel",
  "state": "KY",
  "zip": "40744",
  "first_seen": "2026-09-28T04:19:14Z",
  "candidate_id": null,
  "resource_id": null,
  "history_paths": [],
  "observations": {
    "name": "AppalReD Legal Aid",
    "normalized_names": [
      "appalred legal aid"
    ],
    "phones": [
      "6065465115",
      "8662775733"
    ],
    "domains": [
      "ardfky.org"
    ],
    "urls": [
      "ardfky.org"
    ],
    "addresses": [],
    "zip": "40744",
    "located_zip": "40744",
    "county": "Laurel",
    "state": "KY",
    "first_seen": "2026-09-28T04:19:14Z",
    "last_seen": "2026-09-28T04:19:14Z",
    "times_seen": 1,
    "source_run_ids": [
      "leadgen-40744-20260928T041914Z"
    ],
    "source_url": "https://www.laurelcohealthdept.org/resources-legal-aid",
    "category": "legal",
    "description": "AppalReD Legal Aid provides free civil legal services to low-income and vulnerable people in 37 eastern/south central Kentucky counties including Laurel. Central intake line and online application available.",
    "url": "https://www.ardfky.org/",
    "address": null,
    "city": "Barbourville",
    "hours": null,
    "eligibility": "Low-income residents of served counties; application required",
    "cost": "free",
    "populations": [],
    "service_types": [
      "appointment",
      "hotline"
    ],
    "source_urls": [
      "https://www.laurelcohealthdept.org/resources-legal-aid",
      "https://www.ardfky.org/"
    ],
    "notes": null,
    "verification_status": "unverified",
    "confidence": "medium",
    "found_in_zip": "40744",
    "session_run_id": "leadgen-40744-20260928T015514Z",
    "found_at": "2026-09-28T02:06:11Z",
    "source_run_id": "leadgen-40744-20260928T041914Z",
    "classification": "new",
    "matched": null
  },
  "claim": null,
  "audit": [
    {
      "event": "imported",
      "at": "2026-09-30",
      "note": "Imported discovery observations; history links are name matches requiring intake confirmation."
    }
  ]
}
